{
  "$schema": "http://json-schema.org/draft-07/schema#",
  "title": "QueueSnapshot",
  "description": "The snapshot the engine publishes and a client app reads (`queue.json`). Unknown fields are ignored; optional fields are `null`.",
  "type": "object",
  "required": [
    "engine",
    "limits",
    "published_at",
    "tickets"
  ],
  "properties": {
    "engine": {
      "description": "Engine state.",
      "allOf": [
        {
          "$ref": "#/definitions/QueueEngine"
        }
      ]
    },
    "limits": {
      "description": "Usage limits.",
      "allOf": [
        {
          "$ref": "#/definitions/QueueLimits"
        }
      ]
    },
    "repos": {
      "description": "Repositories the engine can take work for.",
      "default": [],
      "type": "array",
      "items": {
        "$ref": "#/definitions/QueueRepo"
      }
    },
    "tickets": {
      "description": "Tickets.",
      "type": "array",
      "items": {
        "$ref": "#/definitions/QueueTicket"
      }
    },
    "runs": {
      "description": "Recent runs.",
      "default": [],
      "type": "array",
      "items": {
        "$ref": "#/definitions/QueueRun"
      }
    },
    "board_error": {
      "description": "An error from reading the board, if any.",
      "default": null,
      "type": [
        "string",
        "null"
      ]
    },
    "chat": {
      "description": "Chat readiness; absent on engines that predate it (a client treats that as unknown).",
      "default": null,
      "anyOf": [
        {
          "$ref": "#/definitions/QueueChat"
        },
        {
          "type": "null"
        }
      ]
    },
    "published_at": {
      "description": "When the snapshot was published, epoch seconds. A NUMBER: real engines write a fractional clock reading.",
      "type": "number",
      "format": "double"
    }
  },
  "definitions": {
    "QueueEngine": {
      "description": "The engine part of the queue snapshot a client app reads.",
      "type": "object",
      "required": [
        "live",
        "mode",
        "outbox_pending",
        "paused"
      ],
      "properties": {
        "live": {
          "description": "The engine process is alive.",
          "type": "boolean"
        },
        "paused": {
          "description": "The engine is paused.",
          "type": "boolean"
        },
        "outbox_pending": {
          "description": "Outbox entries not yet delivered.",
          "type": "integer",
          "format": "uint32",
          "minimum": 0.0
        },
        "mode": {
          "description": "`live` or a test mode name.",
          "type": "string"
        }
      }
    },
    "QueueLimits": {
      "description": "The usage limits part of the queue snapshot.",
      "type": "object",
      "properties": {
        "five_hour": {
          "description": "Five-hour window fraction used, or `null`.",
          "default": null,
          "type": [
            "number",
            "null"
          ],
          "format": "double"
        },
        "seven_day": {
          "description": "Seven-day window fraction used, or `null`.",
          "default": null,
          "type": [
            "number",
            "null"
          ],
          "format": "double"
        },
        "status": {
          "description": "`ok`, `paused`, `unknown`, ...",
          "default": null,
          "type": [
            "string",
            "null"
          ]
        },
        "resets_at": {
          "description": "Reset time, epoch seconds.",
          "default": null,
          "type": [
            "integer",
            "null"
          ],
          "format": "int64"
        },
        "report_age_s": {
          "description": "Age of the usage report, seconds.",
          "default": null,
          "type": [
            "integer",
            "null"
          ],
          "format": "int64"
        },
        "ceilings": {
          "description": "The ceilings the engine pauses at, when it reports them.",
          "default": null,
          "anyOf": [
            {
              "$ref": "#/definitions/QueueCeilings"
            },
            {
              "type": "null"
            }
          ]
        }
      }
    },
    "QueueCeilings": {
      "description": "The usage ceilings the engine pauses at.",
      "type": "object",
      "properties": {
        "five_hour": {
          "description": "Five-hour ceiling, 0.0 to 1.0.",
          "default": null,
          "type": [
            "number",
            "null"
          ],
          "format": "double"
        },
        "seven_day": {
          "description": "Seven-day ceiling, 0.0 to 1.0.",
          "default": null,
          "type": [
            "number",
            "null"
          ],
          "format": "double"
        }
      }
    },
    "QueueRepo": {
      "description": "A repository the engine can take work for.",
      "type": "object",
      "required": [
        "name"
      ],
      "properties": {
        "name": {
          "description": "`owner/name`.",
          "type": "string"
        },
        "label": {
          "description": "Display name.",
          "default": null,
          "type": [
            "string",
            "null"
          ]
        },
        "can_implement": {
          "description": "Whether the engine may implement (not only refine) work here.",
          "default": false,
          "type": "boolean"
        },
        "enabled": {
          "description": "Whether the repository is enabled.",
          "default": false,
          "type": "boolean"
        }
      }
    },
    "QueueTicket": {
      "description": "A ticket as a client app shows it.",
      "type": "object",
      "required": [
        "key",
        "stage",
        "summary"
      ],
      "properties": {
        "key": {
          "description": "The ticket key, e.g. `QR-12`.",
          "type": "string"
        },
        "summary": {
          "description": "Title (replaced for restricted tickets).",
          "type": "string"
        },
        "status": {
          "description": "Tracker status.",
          "default": null,
          "type": [
            "string",
            "null"
          ]
        },
        "project": {
          "description": "Project key.",
          "default": null,
          "type": [
            "string",
            "null"
          ]
        },
        "type": {
          "description": "Issue type.",
          "default": null,
          "type": [
            "string",
            "null"
          ]
        },
        "labels": {
          "description": "Labels.",
          "default": [],
          "type": "array",
          "items": {
            "type": "string"
          }
        },
        "repo": {
          "description": "Repository `owner/name`, if known.",
          "default": null,
          "type": [
            "string",
            "null"
          ]
        },
        "restricted": {
          "description": "Restricted tickets show only their key.",
          "default": false,
          "type": "boolean"
        },
        "stage": {
          "description": "One of the lifecycle stages (`not-approved`, `queued`, `working`, `refinement-ready`, `needs-you`, `awaiting-merge-approval`, `merge-approved`, `review-blocked`, `done`).",
          "type": "string"
        },
        "stage_text": {
          "description": "Human text for the stage.",
          "default": null,
          "type": [
            "string",
            "null"
          ]
        },
        "actions": {
          "description": "Actions the viewer may take now.",
          "default": [],
          "type": "array",
          "items": {
            "type": "string"
          }
        },
        "pr": {
          "description": "The attached PR.",
          "default": null,
          "anyOf": [
            {
              "$ref": "#/definitions/QueuePr"
            },
            {
              "type": "null"
            }
          ]
        },
        "needs_repo": {
          "description": "True if the ticket needs a repository before it can be readied.",
          "default": false,
          "type": "boolean"
        },
        "suggested_repo": {
          "description": "A repository the engine suggests for this ticket.",
          "default": null,
          "type": [
            "string",
            "null"
          ]
        }
      }
    },
    "QueuePr": {
      "description": "A pull request attached to a ticket.",
      "type": "object",
      "required": [
        "number",
        "state",
        "url"
      ],
      "properties": {
        "url": {
          "description": "The PR URL.",
          "type": "string"
        },
        "number": {
          "description": "The PR number.",
          "type": "integer",
          "format": "uint64",
          "minimum": 0.0
        },
        "state": {
          "description": "`open`, `merged`, `closed`.",
          "type": "string"
        },
        "review_blocked": {
          "description": "True if review blocked it.",
          "default": false,
          "type": "boolean"
        },
        "sha": {
          "description": "Head commit.",
          "default": null,
          "type": [
            "string",
            "null"
          ]
        }
      }
    },
    "QueueRun": {
      "description": "A recent run, as a client app lists it.",
      "type": "object",
      "required": [
        "id",
        "key"
      ],
      "properties": {
        "id": {
          "description": "Run id.",
          "type": "string"
        },
        "key": {
          "description": "The ticket key.",
          "type": "string"
        },
        "lane": {
          "description": "The lane it ran in.",
          "default": null,
          "type": [
            "string",
            "null"
          ]
        },
        "executor": {
          "description": "The executor.",
          "default": null,
          "type": [
            "string",
            "null"
          ]
        },
        "state": {
          "description": "The run's state.",
          "default": null,
          "type": [
            "string",
            "null"
          ]
        }
      }
    },
    "QueueChat": {
      "description": "Whether the engine can host chat sessions, and what is missing. No secrets.",
      "type": "object",
      "properties": {
        "enabled": {
          "description": "Chat is switched on.",
          "default": false,
          "type": "boolean"
        },
        "credential": {
          "description": "`present` or `missing`.",
          "default": null,
          "type": [
            "string",
            "null"
          ]
        },
        "workspace": {
          "description": "`clean`, `findings` or `unknown`.",
          "default": null,
          "type": [
            "string",
            "null"
          ]
        },
        "findings": {
          "description": "Number of workspace findings.",
          "default": 0,
          "type": "integer",
          "format": "uint32",
          "minimum": 0.0
        },
        "live_sessions": {
          "description": "Live chat sessions.",
          "default": 0,
          "type": "integer",
          "format": "uint32",
          "minimum": 0.0
        },
        "ready": {
          "description": "Enabled, credentialed and clean.",
          "default": false,
          "type": "boolean"
        }
      }
    }
  }
}
